{
  "apiVersion": "aok/v1alpha1",
  "kind": "AgentAssignment",
  "id": "explore-aok-001",
  "agent": "repository-explorer",
  "taskPacket": "examples/task-packet.json",
  "executionProfile": "opencode-exploration",
  "inputs": {
    "repository": ".",
    "depth": "deep"
  },
  "outputs": {
    "contract": "repository-exploration-report",
    "parameters": {
      "includeEvidence": true
    }
  }
}
